adult,backdrop_path,genre_ids,id,original_language,original_title,overview,popularity,poster_path,release_date,title,video,vote_average,vote_count
False,/9nhjGaFLKtddDPtPaX5EmKqsWdH.jpg,"[10749, 878, 53]",950396,en,The Gorge,"Two highly trained operatives grow close from a distance after being sent to guard opposite sides of a mysterious gorge. When an evil below emerges, they must work together to survive what lies within.",45.448,/7iMBZzVZtG0oBug4TfqDb9ZxAOa.jpg,2025-02-13,The Gorge,False,7.771,1882
False,/gFFqWsjLjRfipKzlzaYPD097FNC.jpg,"[28, 53, 80]",1126166,en,Flight Risk,"A U.S. Marshal escorts a government witness to trial after he's accused of getting involved with a mob boss, only to discover that the pilot who is transporting them is also a hitman sent to assassinate the informant. After they subdue him, they're forced to fly together after discovering that there are others attempting to eliminate them.",43.199,/q0bCG4NX32iIEsRFZqRtuvzNCyZ.jpg,2025-01-22,Flight Risk,False,6.099,454
False,/87GU2ifjNYtgYtcRH1NNH1P4ODo.jpg,"[18, 35, 10749]",1064213,en,Anora,"A young sex worker from Brooklyn gets her chance at a Cinderella story when she meets and impulsively marries the son of an oligarch. Once the news reaches Russia, her fairytale is threatened as his parents set out to get the marriage annulled.",34.869,/qh8m8Udz0sCa5gy9VaqfHPh0yPM.jpg,2024-10-14,Anora,False,7.1,1666
False,/1w8kutrRucTd3wlYyu5QlUDMiG1.jpg,"[12, 10751, 16]",762509,en,Mufasa: The Lion King,"Mufasa, a cub lost and alone, meets a sympathetic lion named Taka, the heir to a royal bloodline. The chance meeting sets in motion an expansive journey of a group of misfits searching for their destiny.",30.416,/lurEK87kukWNaHd0zYnsi3yzJrs.jpg,2024-12-18,Mufasa: The Lion King,False,7.5,1615
False,/zo8CIjJ2nfNOevqNajwMRO6Hwka.jpg,"[16, 12, 10751, 35]",1241982,en,Moana 2,"After receiving an unexpected call from her wayfinding ancestors, Moana journeys alongside Maui and a new crew to the far seas of Oceania and into dangerous, long-lost waters for an adventure unlike anything she's ever faced.",29.661,/aLVkiINlIeCkcZIzb7XHzPYgO6L.jpg,2024-11-21,Moana 2,False,7.2,1858
False,/zOpe0eHsq0A2NvNyBbtT6sj53qV.jpg,"[28, 878, 35, 10751]",939243,en,Sonic the Hedgehog 3,"Sonic, Knuckles, and Tails reunite against a powerful new adversary, Shadow, a mysterious villain with powers unlike anything they have faced before. With their abilities outmatched in every way, Team Sonic must seek out an unlikely alliance in hopes of stopping Shadow and protecting the planet.",28.381,/d8Ryb8AunYAuycVKDp5HpdWPKgC.jpg,2024-12-19,Sonic the Hedgehog 3,False,7.704,2147
False,/zdNiCWClNFjFvl8KQ5sTlOKmBAB.jpg,[27],1286663,en,Control Freak,"A motivational speaker, plagued by an uncontrollable itch on her head, becomes infected with a parasitic demon from her homeland.",24.99,/kmQb07CrOddVGV0Q73aeU4e8I18.jpg,2025-03-13,Control Freak,False,6.0,7
False,/6J259Zuq09Bt2PLUNeTS5a3DwLZ.jpg,"[28, 53]",1212855,en,Fight or Flight,A mercenary takes on the job of tracking down a target on a plane but must protect her when they're surrounded by people trying to kill both of them.,24.311,/x4nWnfgJvL045rcUCSJzfgIIY9i.jpg,2025-03-13,Fight or Flight,False,6.267,15
False,/ywe9S1cOyIhR5yWzK7511NuQ2YX.jpg,"[28, 53, 878]",822119,en,Captain America: Brave New World,"After meeting with newly elected U.S. President Thaddeus Ross, Sam finds himself in the middle of an international incident. He must discover the reason behind a nefarious global plot before the true mastermind has the entire world seeing red.",24.033,/pzIddUEMWhWzfvLI3TwxUG2wGoi.jpg,2025-02-12,Captain America: Brave New World,False,6.166,1006
False,/hNA73rnG4PjSwgojaC2gbO1f8Rt.jpg,"[878, 35, 12]",696506,en,Mickey 17,"Unlikely hero Mickey Barnes finds himself in the extraordinary circumstance of working for an employer who demands the ultimate commitment to the job… to die, for a living.",23.54,/edKpE9B5qN3e559OuMCLZdW1iBZ.jpg,2025-02-28,Mickey 17,False,7.0,502
False,/5zz7MfcUhYpxT6AaNyUF7jwOmKh.jpg,"[53, 9648, 27]",1202479,en,Opus,"A young writer is invited to the remote compound of a legendary pop star who mysteriously disappeared thirty years ago. Surrounded by the star's cult of sycophants and intoxicated journalists, she finds herself in the middle of his twisted plan.",23.221,/m0du9dsiOVeb0SgfqR8ZAEPRxww.jpg,2025-03-13,Opus,False,6.0,4
False,/mAuqcQLRqliNatDF9R4a3dz7sss.jpg,[18],1171153,de,Köln 75,"Behind one of the best-selling jazz records of all time, Keith Jarrett’s 1975 Köln Concert, how it almost didn’t happen, and how one formidable German teenager, Vera Brandes, breaks every boundary to set the conditions for the creation of a masterpiece. Vera, still in high school when she started producing and promoting music concerts in Cologne, puts everything on the line to put on this show. But Vera believes in the power of music, and she’s never seen anyone play like Keith Jarrett before.",22.924,/6ZvdCexhNarRsZVDShialfsK5lf.jpg,2025-03-13,Köln 75,False,0.0,0
False,/eKUcoySFWU8BAWTYaLHcalg9KDR.jpg,"[18, 10749, 10402]",1182088,pt,O Melhor Amigo,"Two great friends meet again after five years. Among so many things that have changed, the resumption of the bond awakens an old feeling for which they remain unprepared.",22.902,/dRzRvvQZE9XfGSTDm2rgolG6e3j.jpg,2025-03-13,The Best Friend,False,4.0,1
False,/cKIH5oCwpAGqCdIrBDrohPJJkwb.jpg,[18],1043808,pt,Vitória,"Inspired by a real woman, who filmed for two years, hidden, the routine of drug dealers on Ladeira dos Tabajaras, in Copacabana, in 2004. At the time, the material was passed on to the police, who opened an investigation and carried out an operation that resulted in in the arrest of more than 30 people, including military police involved with the gang.",22.814,/tiIwRMsmJnzXuCdPu38lCscgCS7.jpg,2025-03-13,Vitória,False,9.0,1
False,/dci3b1dC8PX3P5ZXnO7v6mjRcpC.jpg,[],1119820,he,The Return from the Other Planet,"In 1945, a few months after his release from Auschwitz, Yechiel De-Nur, still in his striped jacket, sat down and started writing. After two weeks, he was reborn as Ka-Tzetnik, “the man from the camps.” The books that he wrote were translated into 32 languages and sold millions, while the author himself hid behind the pseudonym Ka-Tzetnik. At the trial of Adolf Eichmann in 1961 his revelatory testimony revealed his true identity as he described Auschwitz as “the other planet,” a place outside of human judgment. Years later, undergoing an experimental LSD treatment for trauma, he revisits his experience, imagining himself as a SS officer, and that changes everything.",22.8,/qaOhBUAJVpFl8zSCXX1qySsydcI.jpg,2025-03-13,The Return from the Other Planet,False,0.0,0
False,/2r3b7XSYr9OfIaKyXmiaFNJc4oh.jpg,"[18, 10749]",1127648,en,Bonjour Tristesse,"At the height of summer, 18-year-old Cécile is languishing by the French seaside with her handsome father, Raymond, and his lover, Elsa, when the arrival of her late mother's friend Anne changes everything.",22.779,/1yYSUbWs11mjl0s7bjRH8gywKQS.jpg,2025-03-13,Bonjour Tristesse,False,0.0,0
False,/qkswMUEGRIiPIEf9hFnhPnUbXCN.jpg,"[53, 18]",1130863,fr,Belle,"A couple have a peaceful existence in a small provincial town. He is a teacher and she runs an opticians practical. Their life is turned upside when Belle, a friend’s daughter who is lodging with them, is found dead in her room.  The husband becomes the prime suspect as the only one at home at the time.",22.775,/5YITitG67kcHNUDJdP5XodlkTlm.jpg,2025-03-13,Belle,False,0.0,0
False,/zySLhWnLLVsIswnbF3q5IlOLVW7.jpg,"[18, 27, 9648]",1429788,id,Samar,"After moving into her family's abandoned house, horror comic artist Ilmira struggles to complete her latest work while battling financial hardship. But when eerie figures from her past stories come to life—especially the haunting Hooded Woman—her reality spirals into a nightmare, forcing her to confront a buried childhood trauma.",22.704,/waEYWR595cnmkr2OXFjasgGyZGt.jpg,2025-03-13,Nightmare,False,10.0,1
False,,"[27, 18]",1317096,th,มูลู หน้าครู,"May, a young architect who has just moved into her new house in the suburbs with her boyfriend Gun, got news of the death of her stepmother, Po. Only Noon, Po's daughter, testifies that someone killed her mother, however, there does not appear to be any clear evidence.  After May decided to take care Noon at her house, Noon has abnormal symptoms as if she had been possessed by a ghost. Whereas May herself, she began to have inability to sleep cause her illness. Gun then asked Chok, Sak and Master Khom to help.  Master Khom immediately realized that there were “black magic” from the past inside her house, he asked all to find the source of this evil. There is a misfortune in the past related to the The Master's Facial Skin which was removed by Master Jong who is another disciple from his same sect was the source of all these horrifying stories.",22.699,/y1aTtWkMjgKgkNa6Zxs3kmxje21.jpg,2025-03-13,Mulu Nakru,False,0.0,0
False,/eJFCdeVz6EBC5WkpkbCwhRJ4iKj.jpg,[9648],1428262,en,Mystery Island: Winner Takes All,"Mystery Island hosts contest winners vying to solve a fake murder for a grand prize, but the event goes awry when an employee is murdered, and secrets are uncovered.",22.676,/gYdmNz3HT22vimRdwVCmhKBSLZV.jpg,2025-03-13,Mystery Island: Winner Takes All,False,0.0,0
False,/6bro7hHYoghblrjAs8NQfvWwLNB.jpg,"[18, 10749]",1353002,es,Lo que escribimos juntos,"Mariano and Juan have been dating for several years; they have a dog and a quiet life. Mariano always wanted to have a small plant nursery away from the city and now that Juan’s work as a writer is more established due to the success of his latest novel, they decide to make that change. While they adjust to their new space and their new routines, they receive a visit from Juan's best friend, who has news to tell them.",22.625,/vIZuwXUvgUPfZFYYduXyJkQ71Ld.jpg,2025-03-13,What We Wrote Together,False,0.0,0
False,/8lQZagBHWUHi7DvjQkSqzbUDaVO.jpg,[35],1376834,de,Überall gibt es ein Hausen,"What happens when seven women meet in one place for a week? Refreshingly unorthodox, THERE IS A HAUSEN EVERYWHERE addresses the fundamental questions of the present. Can we accept other people as they are and as they live? What is perception and what is reality? And when we talk about truth, what do we mean? In this comedy that plays with the absurdities of everyday life, the seminar community in Hausen becomes a microcosmic image of society.",22.555,/l3cHgCZxdoSyF7Vd45HdwjreXot.jpg,2025-03-13,There is a Hausen Everywhere,False,0.0,0
False,,[18],1384565,ne,अन्जिला,"The film draws inspiration from the life of Anjila Tumbapo Subba, the goalkeeper of the Nepal women’s national football team. Anjila herself is in the lead role, sharing the screen with actors Dayahang Rai, Miruna Magar, Srijana Subba and others.",22.537,/nnJl15h9biAgCpZ6gYFof0KMD4E.jpg,2025-03-13,Anjila,False,0.0,0
False,/b3mdmjYTEL70j7nuXATUAD9qgu4.jpg,"[16, 14, 12]",823219,lv,Straume,"A solitary cat, displaced by a great flood, finds refuge on a boat with various species and must navigate the challenges of adapting to a transformed world together.",22.528,/imKSymKBK7o73sajciEmndJoVkR.jpg,2024-08-29,Flow,False,8.288,1507
False,/xiBr5BQmIjI8rAcMRAc6XkS4Wav.jpg,"[10749, 53]",1216571,fr,June et John,"The story of John, a man who leads an ordinary life with a monotonous routine. His existence flows away dull, and he himself makes no effort to change anything; on the contrary, he does everything to continue being an ordinary man.  One day John runs into a woman on the subway who is as beautiful as she is mysterious named June. His encounter with her finally leads him to have a goal in his bumptious life: to love June to the end of his days and at any cost.",22.526,/fuGPUHzYq4ssMPBM2Gn8X9QKqCr.jpg,2025-03-13,June and John,False,0.0,0
False,/lFmLxg61GXGCYowoQn0gSdZUQHI.jpg,[18],1400932,lv,Mūžīgi jauni,A coming of age story about a group of millennials who start to face their self-destructive tendencies as they each head straight into their crisis of thirtysomethings.,22.489,/zSXPnFB68yEokjRf4Ss2Y5F6toZ.jpg,2025-03-13,Youth Eternal,False,0.0,0
False,/32OKhnDgNyQFKlIMnefm9RbVKHs.jpg,[18],1404172,hr,Zečji nasip,"A story about a forbidden love set in a village threatened by swollen rivers. Upon his return home for his father’s funeral, Slaven revives his relationship with his childhood friend, a young sportsman named Marko, his teenage love, and the reason his father kicked him out of the house. Now tempted to reunite, they need to make peace with their own decisions and struggle against the family restraints.",22.48,/3jwR4NtikY53SO5agejuEYEzoh3.jpg,2025-03-13,Sandbag Dam,False,0.0,0
False,,[],1412392,id,Samar: Diam Atau Mati,Horror film about the negative impact of bullying in public schools,22.461,,2025-03-13,Samar: Diam Atau Mati,False,0.0,0
False,,"[14, 27]",1077281,ko,커플지옥,"A couple is kidnapped by a serial killer on their first anniversary. The kidnapper forces the couple to play a twisted game of rock paper scissors. Hyunsoo encounters a lady who looks very similar to his favorite adult streamer while delivering food to her. He gradually begins to believe that the lady is indeed the streamer and tries to contact her. Sumi needs to buy a luxury bag for her boyfriend’s birthday. But the bag is too expensive for her to purchase. So, she makes a unique trade with a wizard. Ji-Eun, who lives with her ill boyfriend, goes out every night but her daily life collapses when she brings a guy she meets at a jazz bar to her house.",22.444,/djnHdHdwiLGYYuUydOSykpp8kdl.jpg,2025-03-13,Couples to Hell,False,0.0,0
False,,"[18, 53]",1421001,ru,Последний день рождения,"A large family gather to celebrate a birthday. It would seem like a great reason to get together. But the family is just a project of one of the ""brothers"" — an experienced psychologist who is conducting an experiment to create a ""happiness formula"". He believes that manipulating others, their emotions and desires, will make them happy. However, love interferes with the mathematical calculations, which can neither be calculated nor predicted.",22.442,/zUjWFRvBJJkCezXzmIfj1dha34P.jpg,2025-03-13,The Last Birthday,False,0.0,0
False,/xNga7a6H0w2a7Aa2TwF40jyjXs.jpg,[],1422072,de,"Der Prank - April, April!","A failed April Fool's joke by twelve-year-old Chinese guest student Xi Zhōu turns the lives of Lucas, who is the same age, and his family upside down.",22.439,/iJt8QQbR0591KG6XmCXUYm3du7b.jpg,2025-03-13,"Der Prank - April, April!",False,0.0,0
False,/1093RXL18CIGpzM7VsEJqjKkkGu.jpg,[99],1422081,de,Sterben ohne Gott,,22.438,/mYMtn4ptf5YyoghgTgz2ER1TKTV.jpg,2025-03-13,Sterben ohne Gott,False,0.0,0
False,/5VSrIF6njdpTHpRLF9nzOhwmFUi.jpg,[27],1429784,id,Singsot: Siulan Kematian,"A kid defies the ancient taboo of whistling at dusk, unleashing a sinister terror tied to a cursed figure who made the same mistake. Bound by an inescapable curse, he’s thrust into a deadly race against time—because if he fails, the nightmare will become his new reality.",22.422,/llZca2miwygKwuyWUpyONCL6VAR.jpg,2025-03-13,Singsot: Siulan Kematian,False,0.0,0
False,,[99],1432795,en,"Luv Ya, Bum!","In the ’70s, Houston was booming... except for the city’s woeful pro football team. The Oilers gambled on hiring Bum Phillips, an unconventional East Texas coach known for cowboy hats, ostrich boots, and folksy one-liners. Ditching tradition and embracing a family-first atmosphere, Bum brought in 'misfits' and 'has-beens' to build a winner. At its peak, Bum’s Oilers blew up into the Luv Ya Blue!’ phenomenon, with Earl Campbell and the Oilers going to war with a Pittsburgh Steelers dynasty. Bum’s success on and off the field, his humanity and unique style left a legacy now carried forward by many, including his son and grandson, celebrated coaches Wade and Wes Phillips.",22.414,,2025-03-13,"Luv Ya, Bum!",False,0.0,0
False,/b4Ml5MwXypvF9k27iPIPfykuS8C.jpg,"[18, 35]",1434291,en,The Long Run,"When two oddball strangers leave their lives behind to chase their Hollywood dreams, they discover that what they lack in talent, they make up for with determination and a shared delusion, leading to an unexpected friendship that will make them question the realities of chasing a dream.",22.411,/n28AFdpqhKO5nt64QHQxClxUP4c.jpg,2025-03-13,The Long Run,False,0.0,0
False,,[99],1434414,en,Available Light,"The film explores notions of home and belonging in contemporary society. Comprising interviews with workers at the Edo Tokyo Open Air Architecture Museum in Tokyo, and fragments of conversations with renters in that city and London, a productive dialectic opens between the museum’s preserved historical ideal of the domestic and the often unsettling realities of temporary accommodation in modern cities. Combining trademark immersive sound design with impressionistic images and abstractions, Quaintance crafts an austere, oneiric and subtly affecting portrait of residential precarity.",22.409,,2025-03-13,Available Light,False,0.0,0
False,,[99],1435275,en,24 Hours of Grace,"Grammy-nominated electronic artist ZHU is running out of time. Having bursted out of the dance scene in 2014 with his hit “Faded”, he finds himself a decade later at a musical crossroad. Steadily touring worldwide on the biggest stages with his band, he returns to San Francisco, a place where he grew up, to record his fourth studio album “Grace”. Inside this gothic cathedral, ZHU and his collaborators finish composing songs which are performed for an audience later that night.",22.407,,2025-03-13,24 Hours of Grace,False,0.0,0
False,/61EvNJYDQa3mTtbA4HLiy6iBLfP.jpg,"[37, 12]",1435766,fr,Dans l'Ombre de Marlow,,22.406,/3fYi5YpnIWftnhkmoHIvFPYDzHw.jpg,2025-03-13,Dans l'Ombre de Marlow,False,0.0,0
False,/qBwaMyVGjscDP1r0uAYkg88DDG6.jpg,"[53, 18]",1437237,it,Gioco pericoloso,"Giada and Carlo are a couple with great complicity and intimacy, while each of them pursues their own career with determination. The young and ambitious Peter fascinates Carlo, who introduces him to the family. However, when Giada sees Peter, she has an unexpected reaction and tries in every way to remove him from their home: he could bring out some unspeakable secret from her past. And yet, the truth always finds a way to come out.",22.404,/xQbyabXxKAS44yXb5BcNmInre5e.jpg,2025-03-13,Gioco pericoloso,False,0.0,0
False,/xsMydIb1kE5AaDeqS46fntOCpQK.jpg,[],1437438,hy,Մի անգամ դպրոցում 2: Վերջին Պահապանը,"Grandfather knows more than you can imagine, but no secret stays in the shadows forever. Dark clouds are gathering over the school, it's time to find out who will be the hero of this story...",22.402,/iHOgzKgdg8yKMTCz6IN47r1jzhv.jpg,2025-03-13,Once Upon a Time in School 2: The Last Guardian,False,0.0,0
False,/dgZx99O6QMNZgZpaep4OTog7FRE.jpg,"[35, 10749]",1438208,uk,Відпустка наосліп,"In the center of the plot is the story of a successful Kyiv businesswoman, who is respected by the management and hated by the entire team. So, to get a little rest from shefini, her subordinates send her on a forced vacation: to the top of the Ukrainian Carpathians. There, the heroine is waiting for a lot of surprises, adventures and unexpected acquaintances. This vacation turns the characters ' lives upside down and changes everything forever.",22.4,/rj6DNIRuhJvuP1cLA31NYtmLZGo.jpg,2025-03-13,Blind Vacation,False,0.0,0
False,,"[10751, 12]",1438502,kk,Қожа: Жаңа саяхат,Coming soon,22.399,/h8mgMiUTpvLpZyresQO8uRXB4RG.jpg,2025-03-13,Kozha: New adventure,False,0.0,0
False,/m7hhlBa2UBiXkQeOUxyBMl1jjeY.jpg,[35],1438696,es,Laia,"Laia needs help, so she decides to gather four mysterious characters for a meeting that quickly spirals out of control.",22.398,/tVLDSmIbXzqhUJfHFdzPOgINFF0.jpg,2025-03-13,Laia,False,0.0,0
False,,[],1438546,en,Angler,"Following the recent death of her sister Ivy, Violet cleans out Ivy’s apartment with the hope of finding some peace. She gets more than she bargained for when a mysterious camera reveals to Violet that Ivy’s troubles were more complicated than they initially appeared, suggesting that someone…or something… may have been behind her untimely end.",22.398,/c21YwjiFsVP0xYw6kx1msNmBRMX.jpg,2025-03-13,Angler,False,0.0,0
False,,"[35, 10751]",1440639,es,Última voluntad,A wealthy family gathers for the reading of Eduardo Tejada's will,22.394,/3xhwYGdZxnoI5JELuLZKs7TB1kd.jpg,2025-03-13,Last will,False,0.0,0
False,/2ta5MfmpxFSnSTOPno7sbdapgBN.jpg,[18],1442764,es,Epílogo,"A young man runs to try to get on the bus, he can't catch it so he has to wait for the next one; while he waits a girl accompanies him at the bus stop.",22.388,/ArCT2H6t1XnbNJDnzOoaD5Nf9bk.jpg,2025-03-13,Epílogo,False,0.0,0
False,,"[18, 35, 10749]",1442388,en,Bukan Jodoh Biasa Nih,"Tells the story of Richard, Jonggi and Lingga, three miskom students who are trying to overcome routine financial problems. Of the many solution options that they often debated, they finally came up with one method that made Richard and his friends take a desperate path. Serve Mr. Brandon's challenge to get a hidden secret box in exchange for money and the heart of his daughter, Marsya.",22.388,/vwQBsapRSSKuGefT2W3qXIrt56v.jpg,2025-03-13,Bukan Jodoh Biasa Nih,False,0.0,0
False,,[27],1442386,en,Uwentira: Kota Jin,"A woman named Dewi visited the city of Palu to look for Salena, her acquaintance. When she arrived at the village, Tiara, her friend, welcomed Dewi warmly. However, Tiara's expression turned cold for a split second when Dewi said the word ""Uwentira"". Tiara's panic increased when she slowly realized the strange behavior of her old friend. A few seconds later, Tiara was sure that the Goddess in front of her now was not the Goddess she knew.",22.388,/1ejZLOpStxnw2RhtlxNHuQ9bJoa.jpg,2025-03-13,Uwentira: Kota Jin,False,0.0,0
False,,"[18, 10749]",1269298,ru,Точка опоры,"A successful film artist plans to go to his hometown for his sister’s wedding, accompanied by a movie star. With his arrival, he is going to humiliate his hated fiancé, the fat man and the slacker Shurik. But a quarrel with the actress ruins not only all his plans, but also radically changes his life. A true story of a selfish macho's reassessment of values.",22.355,/sYOnVTrE5JbBTfsRcaagKLV5Nc4.jpg,2025-03-13,The Fulcrum,False,0.0,0
False,/dPbrBB01nNl4oDJFOWvkUMoDOHR.jpg,[18],1271724,ru,Мужчина и женщина,"Poignant stories about men and women who have linked their lives — some for years, some for an hour, some for five minutes. Life stories that sound at home in the kitchen, in a compartment with strangers, in a taxi, or left in a notebook as a memory, because if the feelings are real, sincere, then it's forever. Moments of strange encounters and bitter breakups, in which you can see something familiar.",22.349,/xqGlDndf1K0CnB6xrXirIjimYbt.jpg,2025-03-13,Man and Woman,False,0.0,0
False,/4HnBkc45h6ABO9i6rbPHTqlKUu8.jpg,"[18, 80]",1013601,en,The Alto Knights,"Two of New York's most notorious organized crime bosses, Frank Costello and Vito Genovese, vie for control of the city's streets. Once the best of friends, petty jealousies and a series of betrayals place them on a deadly collision course that will reshape the Mafia (and America) forever.",21.486,/95KmR0xNuZZ6DNESDwLKWGIBvMg.jpg,2025-03-14,The Alto Knights,False,0.0,0
False,/75RPFgjv5nCmxR9xJcvvOJrcsAS.jpg,[99],1422166,en,The Age of Disclosure,"Director Dan Farah got 34 senior members of the U.S. Government, military, and intelligence community to come on camera. He says they reveal an 80 year cover-up of the existence of non-human intelligent life and a secret war amongst major nations to reverse engineer technology of non-human origin. The film explores the profound impact the situation has on the future of humanity, while providing a look behind-the-scenes with those at the forefront of the bi-partisan disclosure effort.",21.274,/qsV4QTjO1jLLezzPA8yRm207ymb.jpg,2025-03-14,The Age of Disclosure,False,0.0,0
False,/7cNE2qydew1c8fqnlhWjkE3DHc2.jpg,"[28, 18, 12, 10752]",927342,ta,அமரன்,"A heroic true story of Major Mukund Varadarajan, an Indian Army officer who displayed extraordinary bravery during a counterterrorism mission in Kashmir’s Shopian district. The film captures his courage in protecting his nation and the devotion of his wife Indhu Rebecaa Varghese.",21.217,/edQwd95BzHY2XaWAoUgS50A4DHT.jpg,2024-10-31,Amaran,False,7.4,190
False,/64jleJJyZj23dj8gpClAn8y6fX5.jpg,[10749],1442538,tl,Elevator Lady,An elevator lady who uses her body to earn more money. She falls for a wealthy married man without her knowing that this will soon lead to her downfall.,21.192,/4Q0eicxd5fq9llcoY2Mf8uUEE5r.jpg,2025-03-14,Elevator Lady,False,0.0,0
False,/IwADj3Pn2s9SLSthhBxZp3X53g.jpg,"[18, 35, 80]",1442417,en,A Murder in Oakland: Beauty is Deadly,"Recently cleared of an embezzlement charge, Detective Williams (Marcus D Spencer) is handed a high-profile murder case while also forced to take on a new partner. Williams is trying to solve this case while also working to see if he can trust his partner.",21.192,/iGz5PJNLHKZnWI2x36kP8igIZOe.jpg,2025-03-14,A Murder in Oakland: Beauty is Deadly,False,1.0,1
False,/yWRYg5M2iEkcZpepQNMfKCs50gt.jpg,[18],1440144,es,La deuda,,21.192,/cZkT8i9Z2yM38UMEDpqMIvcXm5D.jpg,2025-03-14,La deuda,False,0.0,0
False,/c5HfaZXhXCv1jwWBYuyD8xPOW3M.jpg,"[18, 10752]",1419826,en,The World Will Tremble,"The incredible, untold true story of how a group of prisoners attempt a seemingly impossible escape from the first Nazi death camp in order to provide the first eyewitness account of the Holocaust.",21.192,/nSVqv6Bx0fDZS55SynC7Kxspw2r.jpg,2025-03-14,The World Will Tremble,False,0.0,0
