adult,backdrop_path,genre_ids,id,original_language,original_title,overview,popularity,poster_path,release_date,title,video,vote_average,vote_count
False,/r8YfVJu9OAzWbTAuuc86CIs1DYN.jpg,"[18, 10402]",661539,en,A Complete Unknown,"New York, early 1960s. Against the backdrop of a vibrant music scene and tumultuous cultural upheaval, an enigmatic 19-year-old from Minnesota arrives in the West Village with his guitar and revolutionary talent, destined to change the course of American music.",7.568,/llWl3GtNoXosbvYboelmoT459NM.jpg,2024-12-18,A Complete Unknown,False,7.2,702
False,/vuQVJYSkrm5lApNtQxOcOtQwxy6.jpg,[],1445302,en,Carabao Cup Final 2025,"The 2025 Carabao Cup final is the upcoming final match of the 2024–25 EFL Cup. It is to be played between Liverpool and Newcastle United at Wembley Stadium in London, England, on 16 March 2025.",7.531,/idI77qU1yZ8kbUfoHgndsgCJbYg.jpg,2025-03-16,Carabao Cup Final 2025,False,0.0,0
False,/3pKIcv6KhUE35jsKnv3MylQ3OT2.jpg,"[80, 28, 878]",198184,en,Chappie,"Every child comes into the world full of promise, and none more so than Chappie: he is gifted, special, a prodigy. Like any child, Chappie will come under the influence of his surroundings—some good, some bad—and he will rely on his heart and soul to find his way in the world and become his own man. But there's one thing that makes Chappie different from any one else: he is a robot.",7.531,/6zmKkfSvo4tBtvGSjn5PofWIvP9.jpg,2015-03-04,Chappie,False,6.8,7999
False,/by8z9Fe8y7p4jo2YlW2SZDnptyT.jpg,"[28, 35, 878]",533535,en,Deadpool & Wolverine,"A listless Wade Wilson toils away in civilian life with his days as the morally flexible mercenary, Deadpool, behind him. But when his homeworld faces an existential threat, Wade must reluctantly suit-up again with an even more reluctant Wolverine.",7.482,/8cdWjvZQUExUUTzyp4t6EDMubfO.jpg,2024-07-24,Deadpool & Wolverine,False,7.6,6872
False,/qvo0g1yeQnYoCcXctSHI4mkoFMc.jpg,"[878, 12, 53]",131631,en,The Hunger Games: Mockingjay - Part 1,Katniss Everdeen reluctantly becomes the symbol of a mass rebellion against the autocratic Capitol.,7.461,/2hTPkBiXoMmrdtYgHtB9WU5dg80.jpg,2014-11-19,The Hunger Games: Mockingjay - Part 1,False,6.813,15976
False,/8sNiAPPYU14PUepFNeSNGUTiHW.jpg,"[12, 18, 878]",157336,en,Interstellar,The adventures of a group of explorers who make use of a newly discovered wormhole to surpass the limitations on human space travel and conquer the vast distances involved in an interstellar voyage.,7.424,/gEU2QniE6E77NI6lCU6MxlNBvIx.jpg,2014-11-05,Interstellar,False,8.5,36702
False,/au3o84ub27qTZiMiEc9UYzN74V3.jpg,"[28, 878, 53]",1035048,en,Elevation,A single father and two women venture from the safety of their homes to face monstrous creatures to save the life of a young boy.,7.205,/tnfc0NJ3BzhJrGJhkkEd6MHBdq5.jpg,2024-11-07,Elevation,False,6.481,616
False,/vHJlbhsXrZ5yrO2KqCbGSIU6fRX.jpg,"[28, 9648, 878, 53]",198663,en,The Maze Runner,"Set in a post-apocalyptic world, young Thomas is deposited in a community of boys after his memory is erased, soon learning they're all trapped in a maze that will require him to join forces with fellow “runners” for a shot at escape.",7.199,/ode14q7WtDugFDp78fo9lCsmay9.jpg,2014-09-10,The Maze Runner,False,7.188,17225
False,/p5ozvmdgsmbWe0H8Xk7Rc8SCwAB.jpg,"[16, 12, 35, 10751]",1022789,en,Inside Out 2,"Teenager Riley's mind headquarters is undergoing a sudden demolition to make room for something entirely unexpected: new Emotions! Joy, Sadness, Anger, Fear and Disgust, who’ve long been running a successful operation by all accounts, aren’t sure how to feel when Anxiety shows up. And it looks like she’s not alone.",7.157,/vpnVM9B6NMmQpWeZvzLvDESb2QY.jpg,2024-06-11,Inside Out 2,False,7.557,5638
False,/gLQoJ9P79g501oEEtrN8zMlCPpx.jpg,"[36, 18, 53, 10752]",205596,en,The Imitation Game,"Based on the real life story of legendary cryptanalyst Alan Turing, the film portrays the nail-biting race against time by Turing and his brilliant team of code-breakers at Britain's top-secret Government Code and Cypher School at Bletchley Park, during the darkest days of World War II.",7.142,/zSqJ1qFq8NXFfi7JeIYMlzyR0dx.jpg,2014-11-14,The Imitation Game,False,7.995,17211
False,/1LSMstNHwJnJD7tpnb8gZcgGNQR.jpg,"[27, 53]",1164355,id,Lembayung,"Arum and Pica, who wanted to complete their internship at Lembayung hospital, had to face mysterious terror from a woman satan who was suspected of hanged herself in the bathroom. The situation became even more tense after they asked others for help to the point where they threatened their own lives and those closest to them.",6.947,/5x9LrW0yvtt6S3XovIQHgXfYvLL.jpg,2024-09-19,Lembayung,False,7.8,7
False,/taC97dzVlFBl0vWzmp6PCBWOQtM.jpg,"[12, 35, 14, 10751]",181533,en,Night at the Museum: Secret of the Tomb,"When the magic powers of The Tablet of Ahkmenrah begin to die out, Larry Daley spans the globe, uniting favorite and new characters while embarking on an epic quest to save the magic before it is gone forever.",6.913,/xwgy305K6qDs3D20xUO4OZu1HPY.jpg,2014-12-17,Night at the Museum: Secret of the Tomb,False,6.216,5929
False,/jcVHl3PNxeKRg3SGK2sZrKxh94a.jpg,"[35, 14]",214756,en,Ted 2,"Newlywed couple Ted and Tami-Lynn want to have a baby, but in order to qualify to be a parent, Ted will have to prove he's a person in a court of law.",6.91,/38C91I7Xft0gyY7BITm8i4yvuRb.jpg,2015-06-25,Ted 2,False,6.3,7556
False,/hfTyu2VPBqLRPo2DauW8q7bh9bm.jpg,"[10751, 12, 35]",516729,en,Paddington in Peru,"Paddington travels to Peru to visit his beloved Aunt Lucy, who now resides at the Home for Retired Bears. With the Brown Family in tow, a thrilling adventure ensues when a mystery plunges them into an unexpected journey through the Amazon rainforest and up to the mountain peaks of Peru.",6.896,/1ffZAucqfvQu36x1C49XfOdjuOG.jpg,2024-11-08,Paddington in Peru,False,6.8,224
False,/1tXlUvfhLVjM5rZcN2783IhCkbu.jpg,"[28, 18]",307081,en,Southpaw,"Billy ""The Great"" Hope, the reigning junior middleweight boxing champion, has an impressive career, a loving wife and daughter, and a lavish lifestyle. However, when tragedy strikes, Billy hits rock bottom, losing his family, his house and his manager. He soon finds an unlikely savior in Tick Willis, a former fighter who trains the city's toughest amateur boxers. With his future on the line, Hope fights to reclaim the trust of those he loves the most.",6.832,/kSQ49Fi3NVTqGGXILmxV2T2pdkG.jpg,2015-03-24,Southpaw,False,7.363,5502
False,/zfbjgQE1uSd9wiPTX4VzsLi0rGG.jpg,"[18, 80]",278,en,The Shawshank Redemption,"Imprisoned in the 1940s for the double murder of his wife and her lover, upstanding banker Andy Dufresne begins a new life at the Shawshank prison, where he puts his accounting skills to work for an amoral warden. During his long stretch in prison, Dufresne comes to be admired by the other inmates -- including an older prisoner named Red -- for his integrity and unquenchable sense of hope.",6.81,/9cqNxx0GxF0bflZmeSMuL5tnGzr.jpg,1994-09-23,The Shawshank Redemption,False,8.708,27882
False,/4s2d3xdyqotiVNHTlTlJjrr3q0H.jpg,"[12, 10751, 16, 28, 35]",177572,en,Big Hero 6,"A special bond develops between plus-sized inflatable robot Baymax, and prodigy Hiro Hamada, who team up with a group of friends to form a band of high-tech heroes.",6.808,/2mxS4wUimwlLmI1xp6QW6NSU361.jpg,2014-10-24,Big Hero 6,False,7.7,15794
False,/hAQnXxOwCjgYcKRgTdYPRC8neqL.jpg,"[28, 18]",811941,te,దేవర: Part 1,"Devara, a fearless man from a coastal region, embarks on a perilous journey into the treacherous world of the sea to safeguard the lives of his people. Unbeknownst to him, his brother Bhaira is plotting a conspiracy against him. As events unfold, Devara passes on his legacy to his mild-mannered and timid son, Varada.",6.767,/A9ENz6d4lC3UYOX8Z1gJwDEo1sM.jpg,2024-09-26,Devara : Part 1,False,7.031,175
False,/Eeuq1qmv8UEsd4sX6BSrGNYR19.jpg,"[53, 28]",1001274,fr,La Nuit se traîne,"Mady, a student, works as a locksmith by night. He helps Claire get into her apartment and soon realizes that she lied to him about her identity and robbed something that belonged to a dangerous man, Yannick. Mady gets embroiled in a manhunt and will have one night to prove his innocence.",6.751,/5NYSdTdM1A4WKDmxwoph7PSFunv.jpg,2024-08-28,Night Call,False,6.773,77
False,/rOmUuQEZfPXglwFs5ELLLUDKodL.jpg,"[28, 14, 35]",845781,en,Red One,"After Santa Claus (codename: Red One) is kidnapped, the North Pole's Head of Security must team up with the world's most infamous tracker in a globe-trotting, action-packed mission to save Christmas.",6.663,/cdqLnri3NEGcmfnqwk2TSIYtddg.jpg,2024-10-31,Red One,False,7.1,2375
False,/vFm4pF0BgaWPj0i2zEiZO6TqEQ0.jpg,"[53, 28]",260346,en,Taken 3,"Ex-government operative Bryan Mills finds his life is shattered when he's falsely accused of a murder that hits close to home. As he's pursued by a savvy police inspector, Mills employs his particular set of skills to track the real killer and exact his unique brand of justice.",6.553,/vzvMXMypMq7ieDofKThsxjHj9hn.jpg,2014-12-16,Taken 3,False,6.259,5826
False,/gWuiOPAz3WImzFZUzHTT6c4omrD.jpg,"[878, 28, 12, 35]",98566,en,Teenage Mutant Ninja Turtles,"When a kingpin threatens New York City, a group of mutated turtle warriors must emerge from the shadows to protect their home.",6.481,/azL2ThbJMIkts3ZMt3j1YgBUeDB.jpg,2014-08-07,Teenage Mutant Ninja Turtles,False,5.913,6844
False,/iJaSpQNZ8GsqVDWfbCXmyZQXZ5l.jpg,"[27, 878]",945961,en,Alien: Romulus,"While scavenging the deep ends of a derelict space station, a group of young space colonizers come face to face with the most terrifying life form in the universe.",5.018,/b33nnKl1GSFbao4l3fZDDqsMx0F.jpg,2024-08-13,Alien: Romulus,False,7.216,3424
False,/cA88pwGnHa64BBcU3R1oCcJH9Qc.jpg,"[28, 27, 53]",970450,en,Werewolves,"A year after a supermoon’s light activated a dormant gene, transforming humans into bloodthirsty werewolves and causing nearly a billion deaths, the nightmare resurfaces as the supermoon rises again. Two scientists attempt to stop the mutation but fail and must now struggle to reach one of their family homes.",4.686,/cRTctVlwvMdXVsaYbX5qfkittDP.jpg,2024-12-04,Werewolves,False,6.239,327
False,/1ufic9NSdolkgNkQSAVjlVp0uqn.jpg,"[9648, 53, 18]",210577,en,Gone Girl,"With his wife's disappearance having become the focus of an intense media circus, a man sees the spotlight turned on him when it's suspected that he may not be innocent.",7.944,/ts996lKsxvjkO2yiYG0ht4qAicO.jpg,2014-10-01,Gone Girl,False,7.9,18871
False,/8sNiAPPYU14PUepFNeSNGUTiHW.jpg,"[12, 18, 878]",157336,en,Interstellar,The adventures of a group of explorers who make use of a newly discovered wormhole to surpass the limitations on human space travel and conquer the vast distances involved in an interstellar voyage.,7.424,/gEU2QniE6E77NI6lCU6MxlNBvIx.jpg,2014-11-05,Interstellar,False,8.5,36698
False,,[35],1443480,de,Der geräderte Mensch,,10.793,/4gQ2ZnfZ6u6WB9iWmWm9sLCLqm1.jpg,2025-03-16,Der geräderte Mensch,False,0.0,0
False,/cShaLua5ZlSGlP5esqsJ1dTBrWi.jpg,"[18, 36]",1442915,bg,Залог,"Before the Liberation, during the years of the exiled Bulgarian revolutionaries in Romania, the Major and the Prime Minister once shared the same ideals, the same home, and even the same woman. Today, the Major orchestrates a conspiracy to overthrow the government led by his former friend, the Prime Minister. The head of state must be assassinated, and the Prince – dethroned. The woman is part of the plot, but she will try to prevent the fratricide.",10.793,/aqsDDMTnmTZwbbZmDepqLFPdoiZ.jpg,2025-03-16,Bet,False,0.0,0
False,/3IcE36HHehBWHDRXSoEQ6hl5ei8.jpg,[18],1440083,es,Marciano García,,10.791,/sdGwrjlFO9NII5mPKf57kCjX9VD.jpg,2025-03-16,Marciano García,False,0.0,0
False,,[],1439526,en,Full Out,"In 19th-century Paris at the Salpêtrière Hospital, patients were hypnotized onstage to reproduce the symptoms of hysteria for public audiences. Over a century later, high school cheerleaders are fainting en masse.",10.791,/eXvVjE5RyNKbxHCmmj1DLu55GKe.jpg,2025-03-16,Full Out,False,0.0,0
False,,[],1439514,en,The Phalanx,"Letters from the Ceresco community trace the fragility of harmony, the dream of life in association. Members of the phalanx drift apart, lingering in private corners, suspended in speculative time.",10.791,/4wgiJBrpvLh9kOe8feXd5MxLbzW.jpg,2025-03-16,The Phalanx,False,0.0,0
False,,[],1439509,en,Songs Overheard in the Shadows,"Balanced on the edge of what is visible, everything comes from nothingness and returns to nothingness. Strands of consciousness trying to convene with each other. Forms of personal significance in a time of crisis, set free into random motion through chance operations. Recurring details point towards a center.",10.791,/3Cgx8CMlZ8BL4ayG9fzZYuK5fYZ.jpg,2025-03-16,Songs Overheard in the Shadows,False,0.0,0
False,/nhjXe1Gb3Hq8Q5COjsY7ehZyJl4.jpg,"[18, 35, 53, 28]",1438267,he,גמד מחמד 4,"Four years have passed since Kfar and Gamadi's last fight, which ended in Gamadi's defeat. As time passes, the neverending threat of Gamadi seems to haunt Kfar, and leads him into a life revolving around the constant seek of revenge, violence and hate. And now with Piggy, his best friend, leaving to join the army. Kfar is left to deal with Gamadi on his own.",10.788,/9jw0tNgP3pRCq3WioDDbjwOI1n4.jpg,2025-03-16,Gamad Machmad 4,False,0.0,0
False,/4XM8DUTQb3lhLemJC51Jx4a2EuA.jpg,"[28, 80, 53, 12, 9648]",385687,en,Fast X,"Over many missions and against impossible odds, Dom Toretto and his family have outsmarted, out-nerved and outdriven every foe in their path. Now, they confront the most lethal opponent they've ever faced: A terrifying threat emerging from the shadows of the past who's fueled by blood revenge, and who is determined to shatter this family and destroy everything—and everyone—that Dom loves, forever.",5.178,/fiVW06jE7z9YnO4trhaMEdclSiC.jpg,2023-05-17,Fast X,False,7.05,5809
False,/ltWJ8Oebg3AHn6pnGlRA31rSlpF.jpg,"[35, 28]",12236,en,Speed Zone,"An illegal race that takes place over the United States and nothing will stop this bunch of racers except for the occasional cop or a damsel in distress. Jackie Chan's car is not in this one, but many new cars make up for that. Who will win? Who will crash? Who will not even finish? Sit down and buckle up for the ride of your life.",4.571,/cmAgnjrH7TlKjYUpS9NMGMlbkre.jpg,1989-04-21,Speed Zone,False,4.5,80
False,/vHJlbhsXrZ5yrO2KqCbGSIU6fRX.jpg,"[28, 9648, 878, 53]",198663,en,The Maze Runner,"Set in a post-apocalyptic world, young Thomas is deposited in a community of boys after his memory is erased, soon learning they're all trapped in a maze that will require him to join forces with fellow “runners” for a shot at escape.",7.199,/ode14q7WtDugFDp78fo9lCsmay9.jpg,2014-09-10,The Maze Runner,False,7.188,17225
False,,[],1309898,en,Robyn Zabukovec Presents,"Intent on figuring out her next horror film, the lines between reality and fiction begin to blur for Robyn Zabukovec as her increasingly violent acts seem to wield no consequences.",4.545,/acHSAKHFETZUxotCtq3UHAKiZm9.jpg,2025-04-11,Robyn Zabukovec Presents,False,0.0,0
False,/24II8yR2KZe5tHRIcGPh6mUslqc.jpg,"[10749, 35]",1444744,ta,கொஞ்சம் காதல் கொஞ்சம் மோதல்,"the Story Revolves Around a Young Man and a Young Woman, Who Pretend to Be Rich in Order to Impress Each Other. According to Them, Money is the Key to Happiness. But, One Day They Find Out That Neither of Them is  Rich. This Bitter Truth Makes Them Feel Disappointed and They Are Parted. Later, They Meet an Elderly Couple Who Share Selfless Love With One Another. The Husband Lives for the Wife and the Wife Lives for the Husband. Their Deep and True Love Impacts the Young Couple. The Conclusion of the Story is Marked by the Profound Transformation in the Young Couple's Mindset, Inspired by the Old Couple's Enduring Love.",10.543,/4Krf4LofZhh6naXxqTczXmQsDic.jpg,2025-03-14,Konjam Kadhal Konjam Modhal,False,0.0,0
False,/eSQx4g1VKwYQ9nyI9H9DIqugAP7.jpg,[18],1444728,nl,Always Trouble,A moral dilemma occurs when a girl attempts to steal from a store.,7.74,/vnll80sI7664B2SaWe4JbDrcdY4.jpg,2025-03-11,Always Trouble,False,0.0,0
False,,"[18, 9648]",1444686,de,Charon,,10.543,/AaWcKpzEstnN2pexQRRFcaZC38t.jpg,2025-03-15,Charon,False,0.0,0
False,/k9Iw1EIVkPrhEbEn6Pxbj59izOG.jpg,"[80, 18]",1444425,pa,ਛੇ-ਛੇ,"A student in Canada faces charges in her husband's death after allegedly deceiving him for visa purposes, highlighting immigrant families' desperate pursuit of opportunities.",10.543,/nYHk4K1mDWPYMK7C52DSkfoG98X.jpg,2025-03-14,Six Each,False,0.0,0
False,,[],1444332,es,"Y por si fuera poco, Godard","Julio, a young man in his twenties, is in a relationship with Gladys, an older woman worried about not appearing like his mother. Amid hidden feelings and the complexities of love, they discover in a downtown café that they have more in common than they ever imagined.",10.543,/eeieVMafshP9PgwnAze9d9McoDT.jpg,2025-03-15,"Y por si fuera poco, Godard",False,0.0,0
False,/hauxZiacg7HkfX8Zj98cuQGPrPE.jpg,[],1411248,en,A Dunces Burden,A Dunces Burden,6.281,/rxpsb3QxebI6OTENlQ4CHkic3jN.jpg,2025-03-10,A Dunces Burden,False,0.0,0
False,/7D2STwd3s2aUj5CSc1cbYjJ3jJP.jpg,[99],1416099,en,Uvalde Mom,"When a school shooting shakes a Texas town, a mom becomes a hero and speaks against a faulty system. The community confronts those who failed its kids.",6.279,/w54WeeYlnDxEysQpCuS7HNzn3ku.jpg,2025-03-10,Uvalde Mom,False,0.0,0
False,,[99],1421971,en,The Tallest Dwarf,Julie Wyman’s quest to find her place within the little people (LP) community at a moment when dwarf identity is poised to radically change. As Julie unpacks the rumors of “partial dwarfism” in her family she finds that hers is the last of a body type she has inherited. She joins forces with a group of dwarf artists to confront the legacy of being tokenized and put on display,6.278,/eyqreJSuWtgXrhrwmk7j7dpYnD2.jpg,2025-03-10,The Tallest Dwarf,False,0.0,0
False,/x3H89QXnyGvw4C8rpBYzK4dWPcX.jpg,[35],1429616,en,Iliza Shlesinger: A Different Animal,"Acclaimed comedian Iliza Shlesinger debuts on Amazon Prime with a no-holds-barred, explosive and relentlessly funny hour special where she covers everything from shower sex, ugly wives and the ideal man to the truth about the ONE thing no woman wants… in this special, nothing is off limits.",6.276,/wcbX32cfEeTvCyiI9icF0sclZKK.jpg,2025-03-10,Iliza Shlesinger: A Different Animal,False,0.0,0
False,,"[18, 35]",1440935,en,Umm,"After years of working in seclusion, Chef Umm is given an order that requires his best efforts and all the love he can give.",6.273,/e0tWabWWrIkTSs9ZZ8mHGye29zb.jpg,2025-03-10,Umm,False,0.0,0
False,,[10402],1439250,en,Broadway’s Leading Ladies,Broadway’s Leading Ladies is a celebration of the profound influence and enduring legacy women have made in theater. Will be broadcasted on PBS.,6.273,,2025-03-10,Broadway’s Leading Ladies,False,0.0,0
False,/vagXo29X4idspRAb3dEiM6i4OOd.jpg,"[27, 9648, 53]",1441003,en,KLLR: 108.7,"When a small town's killer strikes again, the town's sheriff works with the premier radio show host to find the killer.",6.271,/wA4rJu9GhKGOfeQieOv63fMR7LX.jpg,2025-03-10,KLLR: 108.7,False,0.0,0
False,/3QeuagbU1YARTkGrPS4dvYSQGZi.jpg,"[10402, 18]",799766,en,Better Man,"Follow Robbie Williams' journey from childhood, to being the youngest member of chart-topping boyband Take That, through to his unparalleled achievements as a record-breaking solo artist – all the while confronting the challenges that stratospheric fame and success can bring.",6.262,/fbGCmMp0HlYnAPv28GOENPShezM.jpg,2024-12-06,Better Man,False,7.6,302
False,,[18],1422033,en,The Infinite Husk,"An alien consciousness, sent to Earth to spy on one of its own kind, learns what it means to be human.",6.26,/6dKjVN1kTkut6qWlyXln1FV4qVQ.jpg,2025-03-10,The Infinite Husk,False,0.0,0
False,/1RkCUPax4TGNsdVPVxkZvAglasG.jpg,"[53, 9648, 18]",1443262,tr,The Curtain of Emotions,,6.226,/ytGGI75HpXOWbYXHYXipCrMWE56.jpg,2025-03-10,The Curtain of Emotions,False,0.0,0
False,/rxMnmklIpunsNsRkQ7hw61ZJa84.jpg,"[80, 28, 53]",189,en,Sin City: A Dame to Kill For,Some of Sin City's most hard-boiled citizens cross paths with a few of its more reviled inhabitants.,6.218,/50kALxDX4mmzIRljbNbPY0u4cie.jpg,2014-08-20,Sin City: A Dame to Kill For,False,6.4,3888
False,/2QMgoiDlTmrO9FngZft8GgZ2SbX.jpg,"[10751, 16, 12, 35]",270946,en,Penguins of Madagascar,"Skipper, Kowalski, Rico and Private join forces with undercover organization The North Wind to stop the villainous Dr. Octavius Brine from destroying the world as we know it.",6.206,/gbrNsZ1dOK789NwWPyC0SuEABgr.jpg,2014-11-22,Penguins of Madagascar,False,6.5,4225
False,/hctfNoMpQGfn3VXdBYb9p0P5bT5.jpg,[18],1097549,en,Babygirl,A high-powered CEO puts her career and family on the line when she begins a torrid affair with her much younger intern.,6.2,/A8HbTd0FemZyFCh5qvJFpHGiwF8.jpg,2024-12-25,Babygirl,False,5.8,557
False,/kydclLUnhGMuoCxl6VRfSSwdRRO.jpg,"[18, 80]",154400,en,The Drop,"Bob Saginowski finds himself at the center of a robbery gone awry and entwined in an investigation that digs deep into the neighborhood's past where friends, families, and foes all work together to make a living - no matter the cost.",6.193,/olQInYvVCW2wycMSU1ogo9Jshml.jpg,2014-09-12,The Drop,False,6.8,2213
False,/vfkzNcVzTRCq3C2jYIZtIjSdwf7.jpg,"[27, 53, 28]",1247019,th,ธี่หยด 2,"Three years after his sister's death, Yak relentlessly searches for the dark spirit that killed her in hopes of seeking revenge.",6.19,/uDW5eeFUYp1vaU2ymEdVBG6g7iq.jpg,2024-10-10,Death Whisperer 2,False,7.0,82
False,/suaEOtk1N1sgg2MTM7oZd2cfVp3.jpg,"[53, 80]",680,en,Pulp Fiction,"A burger-loving hit man, his philosophical partner, a drug-addled gangster's moll and a washed-up boxer converge in this sprawling, comedic crime caper. Their adventures unfurl in three stories that ingeniously trip back and forth in time.",6.175,/vQWk5YBFWF4bZaofAbv0tShwBvQ.jpg,1994-09-10,Pulp Fiction,False,8.5,28426
False,/lW4khyV5muPSs2BblMVnutnIjdw.jpg,"[12, 18, 28]",147441,en,Exodus: Gods and Kings,"The defiant leader Moses rises up against the Egyptian Pharaoh Ramses, setting 400,000 slaves on a monumental journey of escape from Egypt and its terrifying cycle of deadly plagues.",6.139,/uaDj37JtvLan9tihxZ18e6qL33b.jpg,2014-12-03,Exodus: Gods and Kings,False,5.9,4585
False,/ysiy0W9nHVTPovvskS34R6ym1Hh.jpg,"[80, 28, 53]",254904,en,The November Man,An ex-CIA operative is brought back in on a very personal mission and finds himself pitted against his former pupil in a deadly game involving high level CIA officials and the Russian president-elect.,6.132,/4ejNFbCgLMDAuy7jFQmc7cr6UAW.jpg,2014-08-27,The November Man,False,6.1,1492
False,/vabhkZ3vwf8u7yXCSi3zbVzAVRa.jpg,"[80, 18, 53]",242582,en,Nightcrawler,"When Lou Bloom, desperate for work, muscles into the world of L.A. crime journalism, he blurs the line between observer and participant to become the star of his own story. Aiding him in his effort is Nina, a TV-news veteran.",6.13,/gYPIRu0jX2CGYdeO422cq3N78ju.jpg,2014-10-23,Nightcrawler,False,7.705,10938
False,/8YNNyQiPZlF9qv5EGOUK20mnXVk.jpg,"[28, 878, 53]",262500,en,Insurgent,Beatrice Prior must confront her inner demons and continue her fight against a powerful alliance which threatens to tear her society apart.,6.127,/dP5Fb6YRfzmCQtRbHOr2kO7tJW9.jpg,2015-03-18,Insurgent,False,6.362,10068
False,/rS8CR6cgTjNiBNQOUkITdeWVZ1k.jpg,"[28, 35]",228967,en,The Interview,"Dave Skylark and his producer Aaron Rapaport run the celebrity tabloid show ""Skylark Tonight"". When they land an interview with a surprise fan, North Korean dictator Kim Jong-un, they are recruited by the CIA to turn their trip to Pyongyang into an assassination mission.",6.122,/tIDC4xT65l7a8qbgg8GvwD5g8c5.jpg,2014-12-25,The Interview,False,6.2,5857
False,/9Xna1fmRkTyAfMSonokrwblYXUS.jpg,"[53, 80, 28]",265208,en,Wild Card,"When a Las Vegas bodyguard with lethal skills and a gambling problem gets in trouble with the mob, he has one last play… and it's all or nothing.",6.119,/zN80Tlly8oMpKbVJv2TfRIj8dHG.jpg,2015-01-14,Wild Card,False,5.677,1802
False,/nFCUBRDF4C6RWopNo0nAfvMA6mm.jpg,[35],225886,en,Sex Tape,"When Jay and Annie first got together, their romantic connection was intense – but ten years and two kids later, the flame of their love needs a spark.  To kick things up a notch, they decide – why not? – to make a video of themselves trying out every position in The Joy of Sex in one marathon three-hour session.  It seems like a great idea – until they discover that their most private video is no longer private.  With their reputations on the line, they know they’re just one click away from being laid bare to the world... but as their race to reclaim their video leads to a night they'll never forget, they'll find that their video will expose even more than they bargained for.",6.119,/pFdS7SIdjcrYXtf141dabWVly9B.jpg,2014-07-17,Sex Tape,False,5.402,4069
False,/uzobkEgGCfVzmXyXKH6Nbrby4Rm.jpg,"[35, 18]",188222,en,Entourage,"Movie star Vincent Chase, together with his boys, Eric, Turtle and Johnny, are back…and back in business with super agent-turned-studio head Ari Gold. Some of their ambitions have changed, but the bond between them remains strong as they navigate the capricious and often cutthroat world of Hollywood.",6.118,/28dqsx1jCxhR05DfH35ui13ywNZ.jpg,2015-06-03,Entourage,False,6.233,1026
False,/4EMd9DU86rbd9XCjOjLHp5Khtn8.jpg,"[53, 10749]",255343,en,Escobar: Paradise Lost,"For Pablo Escobar family is everything. When young surfer Nick falls for Escobar's niece, Maria, he finds his life on the line when he's pulled into the dangerous world of the family business.",6.117,/4HngNLzCmUYCPB8FbxSZWN0eDKM.jpg,2014-10-11,Escobar: Paradise Lost,False,6.273,774
